category,question,answer,ideology
intentionality-ancient,What do Stoics define as the content of mental representations (phantasiai)?,"According to Stoics, lekta constitute the content of mental representations (phantasiai), which they define as ""what subsists in correspondence with a rational representation,"" where a rational representation is one that belongs to rational animals like ourselves.",stoicism
intentionality-ancient,"What is the Stoic view on when reason emerges in humans, and do they believe that nonrational animals have representations with content?","The Stoics believe that reason emerges in humans at a later stage, either at age seven or fourteen, after sufficient concepts have been acquired and systematized. They also acknowledge that some concepts in humans are formed naturally from perceptions and memories alone, unaided by reason. Therefore, it is reasonable to infer that they would also believe that nonrational animals have representations with content, at least for perceptual representations, since it would be inconsistent to deny it based on their overall viewpoint",stoicism
intentionality-ancient,What do the Stoics believe about lekta and their involvement in causal interactions?,"The Stoics believe that lekta are involved in every causal interaction, where the lekton specifies the fully determinate effect of the agent on the patient. They hold a causal theory of representation and define representations as the effect produced on the soul by the object of representation, which is compared to the impression a signet ring makes in wax.",stoicism
jefferson,What is the philosophical orientation of Jefferson's natural-law theory in relation to Hobbesian and Rousseauian theories?,"Jefferson's natural-law theory is Stoical, distinct from both Hobbesian and Rousseauian theories. According to Jefferson's Stoical view, the fundamental laws of nature that exist in the state of nature persist in civil society, and they also remain the same between states.",stoicism
justice-virtue,Which ethical tradition had little to say about justice according to Annas's statement?,Stoicism had little to say about justice according to Annas's statement.,stoicism
justice-virtue,"What is the origin of reasons for action, according to Greek eudaimonist views?","According to Greek eudaimonist views, which include Plato, Aristotle, the Stoics, and Epicurus, reasons for action arise from our interest in a happy life.",stoicism
kant-religion,"What is the ""Conundrum"" objection that critics raise against Kant's views on Original Sin and moral worth, and how does Andrew Chignell propose that Kant can resolve this issue?","The ""Conundrum"" objection is a criticism that Kant's acceptance of both the Augustinian conception of Original Sin and his so-called ""Stoic Maxim"" of moral worth determined entirely by oneself leads to an inconsistency. Critics argue that this leaves no room for divine aid in moral improvement. Andrew Chignell proposes that Kant can resolve this issue by appealing to hope, as hope is rationally permissible in the face of a (seeming) impossibility so long as it does not rise to an impossibility of ""the most fundamental modal level."" This allows Kant to acknowledge the need for divine aid in moral improvement while maintaining his Stoic Maxim of moral worth determined entirely by oneself, even if it can only be achieved through hope.",stoicism
legrand,"What is the early ethical view expressed in Le Grand's work Le Sage des Stoïques, ou l'Homme sans Passions?","In Le Sage des Stoïques, ou l'Homme sans Passions, Le Grand espouses the Stoical doctrines of Seneca, advocating for the expungement of passions in the pursuit of moral life.",stoicism
justus-lipsius,Who is considered as the founding father of Neostoicism during the late sixteenth and seventeenth centuries in Europe?,"Justus Lipsius (Joost Lips), a humanist and classical scholar, is considered as the founding father of Neostoicism during the late sixteenth and seventeenth centuries in Europe.",stoicism
justus-lipsius,What was the purpose of the writing of De constantia by Justus Lipsius?,"The purpose of De constantia was to combine Stoicism and Christianity, creating a new philosophy to assist individuals in living through the religious wars and establishing constancy as the most important of virtues.",stoicism
justus-lipsius,What positions did Lipsius hold in Louvain and what works did he publish during his final period there?,"In Louvain, Lipsius held the chair of history at the university and the chair of Latin at the Collegium Trilingue. During his final period in Louvain (1592-1605), he prepared his edition of Seneca and his treatises on Stoic doctrines and physics. He also continued to write on classical scholarship and political philosophy, publishing antiquarian treatises on the cross, the Roman army, Roman fortifications and armaments, the grandeur of Rome, ancient libraries, the Roman goddess Vesta and the Vestal virgins, as well as monographs on political advice and examples, and devotional tracts in honor of the Holy Virgin of Halle and Scherpenheuvel, thus supporting the religious and political agenda of the Archdukes Albert and Isabella.",stoicism
justus-lipsius,What was the purpose of Lipsius's publication of his letter collections?,"The purpose of Lipsius's publication of his letter collections was to extend his humanist scholarship and his Neostoic intellectual program, as well as to showcase his friendships, thoughts, feelings, teachings, and attempts at self-presentation.",stoicism
justus-lipsius,How did Lipsius reportedly describe Stoicism when he was encouraged to think of its consolations as he lay on his deathbed?,"Lipsius reportedly described Stoicism as ""vain"" when he was encouraged to think of its consolations as he lay on his deathbed. He instead pointed to a crucifix and referred to it as ""true endurance"".",stoicism
justus-lipsius,What was the subject of Lipsius's first major work that combined Stoicism and Christianity?,"The subject of Lipsius's first major work that combined Stoicism and Christianity was ""On Constancy in Times of Public Calamity"", published in 1583/4.",stoicism
justus-lipsius,What is the Stoic concept of constancy based on and what role does patience play in it?,"The Stoic concept of constancy is based on essential Stoic attributes such as reason, freedom from emotions, patience in adversity, and subjection to God's will. Patience plays a significant role in constancy as it governs it and is considered the mother of constancy. Stoics believe that cultivating constancy allows one to live contentedly amidst the decay and turmoil of the world, with an unchanging mental state (constantia) that is not influenced by external circumstances.",stoicism
justus-lipsius,What must we attempt to conquer according to the Stoics in order to achieve peace of mind?,"According to the Stoics, we must attempt to conquer our passions and emotions such as desire, joy, fear, and pain as well as our false opinions in order to achieve peace of mind. They believe that reason can help us conquer these harmful emotions and that we should strive to eliminate emotions such as deception, patriotism, and pity for the misfortunes of others as they only bring us harm.",stoicism
justus-lipsius,What was the result of Lipsius's adaptation of Stoic apatheia and fate into Christian terms?,The result of Lipsius's adaptation of Stoic apatheia (emotionlessness) as an appropriate antidote to the religious and political passions of his day and of his transformation of Stoic fate into Christian divine providence was that his brand of Neostoicism became as suitable for Christians as the Aristotelianism of Thomas Aquinas and the Platonism of Marsilio Ficino.,stoicism
justus-lipsius,What was Lipsius's view on how to prevent a monarch from abusing his power?,"Lipsius believed that educating a monarch thoroughly in Stoic ethics was the way to prevent him from abusing his power, rather than threatening him with revolt or tyrannicide.",stoicism
justus-lipsius,What was Lipsius's plan regarding Stoicism after publishing his Manuductio ad Stoicam philosophiam and Physiologia Stoicorum?,"Lipsius intended to complete a third work, Ethica, that would focus on Stoicism's compatibility with Christian doctrine. However, he never finished it.",stoicism
justus-lipsius,How did Lipsius interpret 'living in accordance with nature' in Stoic ethics?,"Lipsius interpreted 'living in accordance with nature' in Stoic ethics as equivalent to 'living according to virtue', with the goal being harmony with nature, universal law of the world, and with the particular rational nature of man.",stoicism
justus-lipsius,"Why, according to Lipsius, must man not oppose the universal laws of human nature in order to obey his own nature?","According to Lipsius, man must not oppose the universal laws of human nature in order to obey his own nature because these laws are dictated by the reason or logos which the Stoics equated with God. By obeying his own nature and aligning himself with these universal laws, man is in essence obeying God and living in true liberty.",stoicism
justus-lipsius,What is the ultimate source of virtue and wisdom according to Lipsius?,"According to Lipsius, virtue and wisdom come from God, who is the source of all knowledge. He identifies the Stoic logos with the Christian God, and thus views the study of God and his logos as equivalent to the Stoic exploration of the relationship of individual to universal nature and the Platonic contemplation of the Good.",stoicism
justus-lipsius,Why did Lipsius reject the Stoic doctrine of ethically indifferent actions?,Lipsius rejected the Stoic doctrine of ethically indifferent actions because it was not compatible with Christianity.,stoicism
justus-lipsius,Why did Lipsius believe that it was essential for living in accordance with nature to have a comprehensive understanding of the physical workings of nature?,"Lipsius believed that Stoic ethics required living in accordance with nature, which in turn demanded a thorough knowledge of the physical workings of nature. He developed this concept in detail in his work, Physiologia Stoicorum, which was a companion piece to his Manuductio.",stoicism
justus-lipsius,What are the three techniques Lipsius uses when dealing with problematic Stoic doctrines in his attempt to reconcile Stoicism with Christianity?,"Lipsius uses allegorical interpretation, identifying similarities with Christian beliefs, and imposing Neoplatonic corrections when dealing with problematic Stoic doctrines in his attempt to reconcile Stoicism with Christianity.",stoicism
justus-lipsius,"How does Stoic philosophy define nature, as reported by Diogenes Laertius in connection with the definition provided by Stobaeus and Plutarch?","The Stoic definition of nature, as reported by Diogenes Laertius and connected with the definition provided by Stobaeus and Plutarch, is that of a craftsmanlike fire that proceeds methodically to create the world and contains within itself all the seminal reasons. According to this definition, everything is constructed by fate in accordance with these reasons.",stoicism
justus-lipsius,What does Lipsius compare the Stoic notion of fire or God containing seminal reasons (rationes seminales) to in his work Physiologia I.6?,"In Physiologia I.6, Lipsius compares the Stoic notion of fire or God containing seminal reasons (rationes seminales) to the biblical account of Moses seeing the light glowing in the bush (Exod. 3:2), the pillar of fire which leads the Israelites through the wilderness (Exod. 14:19), and the burning tongues of the Apostles (Acts 2:3).",stoicism
justus-lipsius,Who does Lipsius cite when arguing that a similar view of God can be found in Christianity as in the Stoics and Hermeticism?,Lipsius cites Posidonius and Hermes Trismegistus when arguing that a similar view of God can be found in Christianity as in the Stoics and Hermeticism.,stoicism
justus-lipsius,What was the goal of Lipsius's selective approach to Stoicism?,"The goal of Lipsius's selective approach to Stoicism was to produce a perfect marriage of pagan and Christian elements, which would serve to enhance the truths of Christianity. He aimed to promote free will, virtue, and social commitment based on a synthesis of Christian and Stoic ethics, and ultimately achieve an acceptable, unifying, and practicable Christian humanitas.",stoicism
logic-ancient,Who were the two main schools that contributed to the development of logic between 100 BCE and 250 CE?,"The two main schools that contributed to the development of logic between 100 BCE and 250 CE were the Peripatetics and the Stoics. They began taking notice of each other's logical systems, leading to the conflation of both terminologies and theories. The Peripatetic adaptation of Stoic syllogistic became known as 'hypothetical sylogistic', while Aristotelian syllogistic was referred to as 'categorical syllogistic'.",stoicism
logic-ancient,Who is considered the second great logician in the history of Stoic logic?,Chrysippus of Soli is considered the second great logician in the history of Stoic logic.,stoicism
logic-ancient,What is the Stoic view on the truth-value of assertibles?,"The Stoics believed that assertibles have a truth-value at any one time, and that truth is temporal, meaning it can change over time. They also held a deflationist view of truth, identifying true assertibles with facts and defining false assertibles as the contradictories of true ones.",stoicism
logic-ancient,How did the Stoics analyze the negation of simple assertibles?,"The Stoics analyzed the negation of simple assertibles in a Russellian manner as 'Both the subject exists and not: the subject has the property expressed by the predicate'. For example, the negation of 'Dion is walking' would be analyzed as 'Both Dion exists and not: Dion is walking'.",stoicism
logic-ancient,What was the primary focus of the Stoics in the field of logic?,"The Stoics developed a propositional logic, which is a system of deduction in which the smallest substantial unanalyzed expressions are propositions or assertibles.",stoicism
logic-ancient,What is the definition of non-simple assertibles in Stoicism and what are the different types of non-simple assertibles that feature in Stoic syllogistic?,"Non-simple assertibles in Stoicism are defined as assertibles that either consist of more than one assertible or of one assertible taken more than once, and that are controlled by a connective particle. There are three types of non-simple assertibles that feature in Stoic syllogistic: conjunctions, disjunctions, and conditionals. Conjunctions are non-simple assertibles put together by the conjunctive connective 'both ... and ...' and have two conjuncts. Disjunctions are non-simple assertibles put together by the disjunctive connective 'either ... or ... or ...' and have two or more disjuncts, all on a par. Conditionals are non-simple assertibles formed with the connective 'if ..., ...' and consist of antecedent and consequent. The type of assertible an assertible is, is determined by the connective or logical particle that controls it, i.e. that has the largest scope.",stoicism
logic-ancient,What is the nature of Stoic disjunction with regards to truth functionality and exclusivity?,"Stoic disjunction is exclusive and non-truth-functional, meaning it is true when necessarily precisely one of its disjuncts is true. Later Stoics introduced an inclusive disjunction which is non-truth-functional as well.",stoicism
logic-ancient,How does a Stoic argument differ from an argument mode?,"A Stoic argument consists of at least two premises and a conclusion, while an argument mode is a schema of an argument where ordinal numbers take the place of assertibles. The mode of an argument differs from the argument itself by providing a general structure that can be instantiated with any content.",stoicism
logic-ancient,What is the second indemonstrable that follows upon assertion in the Stoic logic system?,The second indemonstrable that follows upon assertion in the Stoic logic system is argument based on hypothetical syllogism.,stoicism
logic-ancient,What is a defining feature of a syllogistic mode in Stoic logic?,"In Stoic logic, a mode is syllogistic if it corresponds to a syllogism in form. This means that if an argument has the same form as the mode in question, then it is a syllogism by virtue of that form.",stoicism
logic-ancient,"How many modes do the Stoics' five meta-linguistic descriptions of indemonstrables correspond to, if complex arguments are disregarded?","If complex arguments are disregarded, there are thirty-two modes that correspond to the five meta-linguistic descriptions of indemonstrables used by the Stoics.",stoicism
logic-ancient,What is a Stoic reduction used for in the context of Stoic logic?,A Stoic reduction is used to demonstrate the formal validity of an argument by transforming it into one or more indemonstrable arguments using the themata in one or more steps. This can be done either with the arguments themselves or their modes.,stoicism
logic-ancient,How can the number of indemonstrables in Stoic logic be reduced according to the text?,The number of indemonstrables in Stoic logic can be reduced to two modes of a second and a third indemonstrable according to the text.,stoicism
logic-ancient,How does a conclusion about the falsity of one assertible follow from the combination of two conditional assertibles and one external assertible according to the three indemonstrables of Stoic logic?,"In Stoic logic, when two assertibles of the form 'If the 1st and the 2nd, the 3rd' and 'But not the 3rd' are given, and a third follows 'Not: both the 1st and the 2nd' (by the second indemonstrable), and from this third assertible and an external assertible 'The 1st' another follows 'Not: the 2nd' (by the third indemonstrable), then this other 'Not: the 2nd' also follows from the two initial assertibles and the external assertible according to the three indemonstrables of Stoic logic.",stoicism
logic-ancient,What was the opinion of the Peripatetics regarding the Stoics' acceptance of reduced arguments?,The Peripatetics criticized the Stoics for allowing arguments that they considered to be useless when those arguments could be reduced.,stoicism
logic-ancient,What logical principles did the Stoics accept in their propositional logic system?,"The Stoics accepted several logical principles in their propositional logic system, including the principle of double negation, the principle of identity for conditionals, the principle of bivalence for two-place disjunctions, and the principle of contraposition.",stoicism
logic-ancient,"How did Chrysippus propose to resolve the Liar paradox, according to the Stoics?","Chrysippus attempted to solve the Liar paradox by positing an ineliminable ambiguity in the Liar sentence between two assertibles, only one of which can be true at any given time. He maintained that bivalence is preserved because the assertibles are incompatible with each other, and each entails a different negation of the other. This approach allowed Chrysippus to uphold the principle of bivalence while also accounting for the paradoxical nature of the Liar sentence.",stoicism
logic-ancient,What were the views of the Epicureans regarding truth-bearers?,"The Epicureans denied the existence of incorporeal meanings, such as Stoic sayables. They held that truth-bearers are linguistic items, specifically, utterances (phônai). Truth consists in the correspondence of things and utterances, while falsehood consists in a lack of such correspondence.",stoicism
logic-ancient,Who were at least two Stoics in the period that wrote a work on Aristotle’s Categories?,"At least two Stoics in this period who wrote a work on Aristotle’s Categories were those whose writings were known to Galen. However, their names are not specified in the provided text.",stoicism
logic-ancient,When did Stoic logic cease to be studied and when was it rediscovered?,"Stoic logic faded into oblivion at some point between the 3rd and 6th century CE and it was not rediscovered until the 20th century, following the (re)-discovery of propositional logic.",stoicism
logic-deontic,Can Stoic deontological logic (SDL) represent the concept of indifference in actions?,"No, Stoic deontological logic (SDL) cannot represent the concept of indifference in actions, despite some claims that it can.",stoicism
logical-form,How can we treat the valid form in (9) as derived from more basic Stoic inference forms?,"We can treat (9) as derived from two more basic Stoic inference forms by showing that any instance of this form is valid given these two inference forms: if the first then the second, and the first, so the second; either not the first or not the second, and the first; so not the second. For example, given the premises A and if A, then either not-A or not-B, we can first infer that either not-A or not-B, and then infer not-B, since we were given A.",stoicism
logical-truth,What do philosophers who accept the idea of formality consider the logical form of a sentence to be?,"Philosophers who accept the idea of formality consider the logical form of a sentence to be a certain schema in which the expressions that are not schematic letters are widely applicable across different areas of discourse. If the schema is the form of a logical truth, all of its replacement instances are logical truths. The idea that logic is especially concerned with (replacement instances of) schemata is evident beginning with Aristotle and the Stoics, in all of whom the word usually translated by “figure” is precisely schema.",stoicism
lucretius,Why might it be more accurate to consider Lucretius as philosophically isolated rather than part of a trend among the Roman intelligentsia during his time?,"Lucretius might be considered philosophically isolated because his poem shows few signs of contemporary philosophical or scientific engagement, despite his knowledge of recent trends in Epicurean school and sophisticated debates with other schools like Stoics. Moreover, his critiques of anonymous opponents do not seem to target anyone who lived between Epicurus' own lifetime and Lucretius', including prominent figures from prestigious schools such as the Stoa.",stoicism
lukasiewicz,How did Jan Łukasiewicz initially express his groundbreaking view on Stoic logic?,"Jan Łukasiewicz first voiced his view that Stoic logic was an early propositional logic at a meeting in Lwów in 1923, which contradicted the then standard opinion that it was a defective Aristotelian syllogistic.",stoicism
marcus-aurelius,Who was both a Roman emperor and a Stoic philosopher in the 2nd century CE?,Marcus Aurelius was both a Roman emperor and a Stoic philosopher in the 2nd century CE.,stoicism
marcus-aurelius,"When was Marcus Aurelius, the famous Stoic philosopher and Roman Emperor, born?",Marcus Aurelius was born in 121 CE.,stoicism
marcus-aurelius,Which philosophers did Marcus Aurelius approvingly quote in addition to Stoic philosophers?,"Marcus Aurelius approvingly quoted Epicurus, Antisthenes, Chrysippus, Democritus, Euripides, Heraclitus, Homer, and Plato in addition to Stoic philosophers.",stoicism
marcus-aurelius,What is the general agreement among scholars about the purpose of Marcus Aurelius' Meditations?,"Scholars generally agree that Marcus Aurelius wrote Meditations for his own moral improvement, to remind himself of and render concrete the Stoic doctrines he wanted to live by, such as the belief in Providence, happiness lying in virtue, and regarding others as siblings. This is based on the work's genre, its early descriptions as precepts, directing, writings to himself, as well as Epictetus' advice on daily writing and rehearsal for moral improvement.",stoicism
marcus-aurelius,"What is the purpose of Marcus Aurelius in writing Meditations, as inferred from its style and content?","Marcus Aurelius wrote Meditations to mentally equip himself to deal with what comes his way, as evidenced by its aphoristic and sloganeering style, lack of specificity in referring to events in his life, use of Stoic terminology without explanation, collection of sayings from various philosophical systems, and the presence of personal faults he aims to combat or correct attitudes he tries to inculcate in his writings. Thus, the reader should approach each assertion in Meditations by studying its 'therapeutic' context and asking what moral and psychological effects Marcus is trying to achieve by saying it.",stoicism
marcus-aurelius,What is the main focus of the article's examination of Stoicism as a way of life according to Hadot's idea?,"The main focus of the article is on the basic question of what a Stoic uses to guide his own conduct, specifically in relation to the two virtues that Marcus Aurelius has the most to say about: justice and piety. The article does not aim to cover all the themes in Marcus' Meditations regarding Stoic life, but rather concentrates on these particular aspects of Stoicism as a way of life.",stoicism
marcus-aurelius,"What does Marcus Aurelius encourage himself to do in Stoic terms, despite finding it challenging?","Marcus Aurelius encourages himself to live as a philosopher, outlining what it entails in Stoic terms.",stoicism
marcus-aurelius,What is the common goal indicated by various Stoic philosophers regarding living well?,"The common goal indicated by various Stoic philosophers regarding living well is to act in accordance with nature, and to be in a certain cognitive state in relation to one's acts according to nature, such as in agreement, on the basis of experience, being reasonable, consistently, and with understanding.",stoicism
