category,question,answer,ideology
al-kindi,Who were some philosophers who believed in the past eternity of the world?,"Aristotle, Stoics, and orthodox Neoplatonists were philosophers who believed in the past eternity of the world. They held that the world has always existed and will never cease to exist.",stoicism
alexander-aphrodisias,Why might Alexander's Ethical Problems be particularly significant in the study of ancient ethics?,"Alexander's Ethical Problems are significant in the study of ancient ethics because they provide a link between Aspasius' early commentary on Aristotle's ethics and the later medieval commentaries, filling a gap in the literature during which time ethics may have become a marginal subject in later antiquity. Additionally, these essays address central issues in Aristotle's ethics, such as pleasure as a good and pain as an evil, the relationship between virtues and vices, virtue as a mean, and involuntary actions. Alexander's discussions also reflect the debates of the Peripatetics with the Epicureans and Stoics in Hellenistic times, offering insight into the broader philosophical discussions of the time period. Finally, Alexander's emphasis on logical and physical distinctions in connection with ethical problems provides further depth to the study of ancient ethics.",stoicism
alexander-aphrodisias,"Who establishes a rigorously physicalist system ruled by an all-pervasive divine mind, leading to a sharpened awareness of the determinism problem?","The Stoics established a rigorously physicalist system ruled by an all-pervasive divine mind, leading to a sharpened awareness of the determinism problem.",stoicism
altruism,Which ancient Greek and Roman philosophers are said to have based their moral philosophy on self-interest?,"Plato, Aristotle, the Stoics, and the Epicureans are said to have based their moral philosophy on self-interest.",stoicism
altruism,"Why might it be reasonable to consider that being a good person is valuable in and of itself, rather than as a means to an end?","It might be reasonable to consider that being a good person is valuable in and of itself, rather than as a means to an end, because it could be a component of well-being and can lead to the development and exercise of cognitive, emotional, and social skills that we are pleased and proud to have. This perspective is not morally offensive and is supported by arguments from philosophers such as Plato, Aristotle, and the Stoics who argue that ethical virtue is of great value because it is a component (and for the Stoics the sole component) of one’s well-being.",stoicism
ammonius,What is the 'Reaper' argument in determinism and who is believed to have originally proposed it?,"The 'Reaper' argument in determinism is an argument that suggests that if an event is going to occur, it is necessarily going to occur, and its opposite is necessarily not going to occur. This argument is believed to have originated from Diodorus Cronus and was later discussed by Zeno the Stoic. It is based on the premise that if an event will happen, it cannot be the case that it might or might not happen. Instead, it will definitely happen. Similarly, if an event will not happen, it cannot be the case that it might happen; it will definitely not happen.",stoicism
plotinus,Why does Plotinus criticize Stoic materialism in his anti-Stoic polemics?,"Plotinus criticizes Stoic materialism because he believes it is incapable of articulating an ontology that includes everything in the universe, providing explanatory adequacy in the physical universe, accounting for consciousness or intentionality in materialistic terms, and giving a coherent justification for their ethical position since their exhortations to the rational life cannot explain how one body is supposed to identify with another body.",stoicism
aristotle-commentators,Who was Boethus of Sidon and what was his contribution to the interpretation of Aristotle's Categories?,"Boethus of Sidon was an ancient interpreter of Aristotle's Categories who was active in the second half of the 1st century BCE. He is known for writing a commentary on the Categories in the form of a word-by-word examination of the whole book. Boethus was highly regarded in antiquity for his sharp intellect and his ability to address the difficulties that the Stoics raised against Aristotle's Categories. He resisted the Stoics' reading of the Categories as a treatise on language and about linguistic expressions, and anticipated a line of interpretation that was followed by other ancient commentators such as Porphyry.",stoicism
antiochus-ascalon,What were some of the works written by Antiochus that demonstrated his interests in epistemology and interschool agreements?,"Antiochus wrote an epistemological work called Canonica in at least two books, which discussed the criterion of truth using the term 'kanôn,' meaning a ruler or straightedge. He also wrote a possibly dialogical epistemological work called The Sosus during his controversy with Philo. Furthermore, he sent a book to the Roman Stoic Balbus, arguing that Stoics and Peripatetics shared substantial agreements despite differences in terminology. Unfortunately, the contents of his book about the gods and his works on happiness and virtue relations remain largely unknown to us today.",stoicism
antiochus-ascalon,"Why was Antiochus of Ascalon, a philosopher who defended Stoic epistemology, able to claim that he was reviving the Old Academy?","Antiochus claimed that the Old Academy, the Peripatos, and the Stoa were in fundamental agreement, and that Zeno of Citium, the founder of Stoicism, was mainly responsible for introducing new terminology and making minor corrections to Old Academic doctrine. This allowed Antiochus to defend Stoic epistemology against the arguments made by his Academic predecessors while still claiming to revive the Old Academy. His arguments were embedded in this reinterpretation of Academic history, and were thus part of an argument about who was the legitimate heir of the school’s tradition.",stoicism
antiochus-ascalon,What is one argument regarding Zeno's engagement with Platonism that has been proposed by some scholars?,Some scholars have argued that Zeno's engagement with Platonism was more thoroughgoing than ancient and modern interpreters who have emphasized his debts to Stoicism tend to allow.,stoicism
antiochus-ascalon,What was the primary method of argument used by the Academic skeptics in their debates with the Stoics?,"The primary method of argument used by the Academic skeptics in their debates with the Stoics was dialectical, where they would put questions to their interlocutors and deduce conclusions unwelcome to them from their replies. They would take their premises from the doctrines of their Stoic opponents or from assumptions that the Stoics could reject only at a high cost in plausibility.",stoicism
antiochus-ascalon,What is the role of cognitive impressions in Stoic epistemology?,"Cognitive impressions are the criterion of truth in Stoic epistemology. They define it as an impression from what is, stamped and impressed in exact accordance with what is, which allows human beings to discriminate cognitive from non-cognitive impressions. By confining assent to cognitive impressions, it is possible to avoid error entirely.",stoicism
antiochus-ascalon,What was the main target of the Academics' arguments and what consequence did they derive based on this target in the context of Stoic epistemology?,"The main target of the Academics' arguments was the existence of the special character alleged to distinguish cognitive impressions from other impressions. Based on this target, they derived the consequence that nothing can be known in the context of Stoic epistemology. This consequence was derived based on the Stoic doctrine that the wise do not hold (mere) opinions.",stoicism
antiochus-ascalon,What is the self-refuting nature of the Academic skeptical position as argued by the Stoics?,"The Stoics argued that the Academic skeptical position is self-refuting since adopting a position requires assent to its component doctrines, which is impossible without taking oneself to know. Therefore, skepticism as advocated by the Academics undermines its own possibility of being adopted as a position.",stoicism
antiochus-ascalon,What was Philo's response to Antiochus' view of two Academies?,"Philo maintained that there had only ever been one Academy, not two as Antiochus believed. He argued that Academics from Plato to Philo himself were not skeptics challenging the possibility of knowledge, but rather their arguments against cognitive impressions were aimed at showing the impossibility of knowledge on the Stoic conception of apprehension, which he believed was mistaken.",stoicism
antiochus-ascalon,What was Philo's innovation in the Stoic account of knowledge and how did Antiochus respond to it?,"Philo rejected the Stoic account of knowledge which required cognitive impressions to be set apart from other impressions by a special character. Instead, he held that it was enough for there to be impressions which are true and accurately formed. Antiochus was disturbed by this innovation as he believed it brought about the result that knowledge is impossible. Antiochus argued that impressions which fail to satisfy the full Stoic definition of the cognitive impression cannot provide a basis for judgment, let alone judgments that deserve to be called knowledge.",stoicism
antiochus-ascalon,"Who did Antiochus claim his ethical theory aligned with, and what was the Peripatetic view on goods that Antiochus was defending?","Antiochus claimed that his ethical theory aligned with that of the Peripatetics and Old Academics. The Peripatetic view on goods was that virtue was the sole good, disagreeing with the Stoics who recognized external and bodily items as goods in addition to virtue. Antiochus defended this Peripatetic view about goods based on Stoic considerations and assumptions, rather than Aristotelian frameworks.",stoicism
antiochus-ascalon,What is the Stoic view on what is good and what is indifferent?,"The Stoics hold that only virtue is good, while all other things such as health and strength are indifferent. However, they make a distinction between preferred and dispreferred indifferents, which provide material for rational selection. Virtue consists in fully rational selection among them, with acts of selection being good as expressions of perfected reason.",stoicism
antiochus-ascalon,What was Antiochus' dilemma for the Stoics regarding preferred indifferents?,"Antiochus presented the Stoics with a dilemma that either preferred indifferents were absolutely indifferent, collapsing the Stoic position into that of philosophers who refused to make distinctions among indifferents and rendered virtue incapable of supplying practical guidance. Alternatively, speaking of preferred indifferents was merely verbal innovation, and the Stoics really regarded them as lesser goods, capable of making a life better by their presence and worse by their absence. Antiochus favored the latter diagnosis, holding that virtue is the chief good, but not the sole good.",stoicism
antiochus-ascalon,"What is the ""cradle argument"" and how is it used in ancient ethics discussions?","The ""cradle argument"" is a method used in ancient ethics discussions to determine the human good by observing the behavior of infants, who have not yet been influenced by society. This approach is based on the principle that the object or objects with which we are naturally concerned or attached by nature provide the basis for determining the human good. The Stoics and Epicureans were known for using this argument, and Antiochus also employed it in his defense of ethics, closely following Stoic theory",stoicism
antiochus-ascalon,What is Antiochus's view on the relationship between virtue and other goods?,"Antiochus holds that virtue is the highest human good, but he believes that other goods also exist and can be enjoyed in the good life. He distinguishes himself from the Stoics by not making virtue the only good.",stoicism
antiochus-ascalon,What is the key difference between Antiochus' view and that of the Stoics regarding human development and goods?,"Antiochus believes that human development leads to valuing reason above all else because it is the most important part of human nature, while Stoics posit a radical transformation towards virtue. Antiochus also maintains that there is room for other goods in addition to virtue as they align with human nature, whereas Stoics tend to focus solely on reason as the only part of human nature.",stoicism
arabic-islamic-greek,"What two doxographies were translated into Arabic during the early translational period in Baghdad, and what were their sources?","Two doxographies translated into Arabic during the early translational period in Baghdad were the Placita of pseudo-Plutarch, which accounted for Greek cosmologies from the Presocratics to the Stoics, and the Refutation of all the Heresies by Hyppolitus of Rome, which was reworked in light of the theological discussions of 9th century Baghdad and attributed to Ammonius, the Alexandrian commentator of Aristotle.",stoicism
arcesilaus,Who was the leader of Plato’s Academy who started the skeptical phase of the Platonic school and was a critic of Stoic epistemology?,"Arcesilaus was the leader of Plato’s Academy who initiated the skeptical phase of the Platonic school (known as ‘Academic skepticism’) and was an influential critic of the Stoics, particularly their epistemology.",stoicism
arcesilaus,What is the second difficulty faced in reconciling Arcesilaus' dialectical method with certain doctrines?,"The second difficulty is that the conclusions of Arcesilaus' dialectical arguments against Stoic doctrines in epistemology and ethics appear to depend crucially on Stoic premises. However, there is reason to believe that Arcesilaus did not accept anything of Stoic epistemology or ethics, and without independent evidence of his acceptance of their shared premises, there is no consistent picture of which conclusions of his dialectical arguments he may have accepted himself.",stoicism
arcesilaus,Who is the philosopher known for his criticisms of Stoic epistemology?,Arcesilaus is the philosopher known for his criticisms of Stoic epistemology.,stoicism
arcesilaus,What is the Stoic psychological theory of belief formation?,"According to the Stoic psychological theory, to form a belief of any kind is to give one's assent to one's 'impression' (or 'appearance') about the matter.",stoicism
arcesilaus,Why did Arcesilaus argue that there is no cognition on Stoic theory?,"Arcesilaus argued that there is no cognition on Stoic theory because condition [c], which states that an impression is cognitive if its truth is warranted by the inimitable richness and detail of its causal history such that its propositional content is entailed by its causal history, never obtains. He supported this claim by arguing that it is always possible to have a false impression with exactly the same propositional content and representational character as a true one that meets condition [b], undermining the self-warrant of any impression based on its representational character.",stoicism
arcesilaus,What consequence does Arcesilaus argue that the Stoics must accept if his argument against cognitive impressions is valid?,"If Arcesilaus' argument against cognitive impressions is valid, he contends that the Stoics must accept the conclusion that it is irrational to assent to anything, also known as universal suspension.",stoicism
arcesilaus,What was Arcesilaus' position on the Stoic definition of cognitive impression and how did he argue for it according to Cicero?,"Arcesilaus agreed that the Stoic definition of cognitive impression could never be met, leading to the conclusion that nothing can be known. He maintained premises 5 and 6 of the second argument and concluded that assent to any impression was irrational. This interpretation of Arcesilaus' skepticism is supported in Cicero's dialogues where Arcesilaus is portrayed as following Socrates, Plato, and Presocratic philosophers in concluding that nothing can be known by perception or reason.",stoicism
arcesilaus,What does the text suggest about Arcesilaus' position on Stoic epistemology?,"The text suggests that Arcesilaus argued against many aspects of Stoic epistemology, including the Stoic theory of the soul's interaction with the body, the causal theory of perception, and the conception of belief as assent to an impression. Additionally, there is reason to doubt Cicero's testimony that Arcesilaus subscribed to Stoic views on cognition, as Arcesilaus may not have accepted that there are impressions, that some are true, that there are no other routes to cognition, or that the Stoic definition of cognition gives necessary and sufficient conditions for knowledge.",stoicism
arcesilaus,What is the conclusion of Arcesilaus' argument against Stoic thesis regarding some rational assents?,The conclusion of Arcesilaus' argument is that it is rational to 'withhold assent' (‘asugkatathetein’) about everything. This conclusion is used to oppose the Stoic thesis that some assents are rational.,stoicism
arcesilaus,What does Arcesilaus' use of premise [11] suggest about his commitment to epochê?,"Arcesilaus' use of premise [11] suggests that his commitment to epochê is independent of Stoic notions like assent and the irrationality of holding opinions, because it is reached only through the equipollence of arguments.",stoicism
arcesilaus,"What belief about knowledge does the NRNB view attribute to Arcesilaus, based on Cicero's writings?","The NRNB view interprets Cicero as confirming that Arcesilaus was committed to the belief that nothing can be known, as part of his anti-Stoic arguments.",stoicism
arcesilaus,What is one of the problems with the view that radical skeptics have beliefs but do not consider them justified?,"One of the problems is that being a rational agent involves exercising some control over one's beliefs through responsiveness to reasons. According to some philosophers, it is not possible for rational agents to give up practices of justification because having beliefs inherently requires a conscious inference about the proper use of concepts, which is made in virtue of reasons (see Williams 2004). One may argue that the skeptic does not preclude herself from responsiveness to reasons but rather lacks confidence in them, but such rationalist theories of agency and belief might be stricter than even the Stoics' theories, against which Arcesilaus argued (see sect. 5 below).",stoicism
arcesilaus,"How does Arcesilaus argue that action is possible without assent, in response to the first Stoic objection?","Arcesilaus argues that action is possible without assent by suggesting that animal action is triggered directly by their impressions of something oikeion (suitable), and that assent is redundant and liable to be a cause of error. Thus, on his view, one can act on their impressions without necessarily giving assent to them.",stoicism
arcesilaus,"What do Sextus, Cicero, and Numenius suggest about Arcesilaus's commitment to a practical criterion of 'the reasonable'?","Sextus does not provide evidence that Arcesilaus supported 'the reasonable' as a practical criterion, stating that Arcesilaus did not define a criterion and that when he seemed to, it was only as a counterblast to the Stoics. Cicero and Numenius do not mention Arcesilaus's adoption of a practical criterion and suggest that Arcesilaus did not offer a position on how one might live without assent, implying that Carneades significantly revised the Academic position in this respect.",stoicism
arcesilaus,What is one issue with interpreting Arcesilaus' stance solely based on premises 13 through 16?,"One issue is that there is no other evidence suggesting Arcesilaus' commitment to these premises, and they could also be premises that he argued against since reports indicate he opposed not only Stoic theory but all ethical views as well.",stoicism
arcesilaus,What is the connection between Arcesilaus' claim that nothing can be known and the Stoic theory of appropriate actions?,"Arcesilaus suggests that even if nothing can be known, the Stoic theory of appropriate actions can still be followed by performing actions that have reasonable defenses or justifications. This allows the sage to act in accordance with their rationality without having beliefs or opinions. However, Arcesilaus' use of the Stoic definition of appropriate actions implies the possibility of knowledge, which he cannot accept while maintaining his claim that nothing can be known.",stoicism
arcesilaus,Why was it unnecessary for Arcesilaus to be invested in rationalizing the life of the skeptic with a theory of action?,"According to the NRB view, Arcesilaus was not personally committed to defending the life of universal suspension against Stoic counterattack and was instead bound by his method to counter it. Therefore, it was unnecessary for him to be invested in rationalizing the life of the skeptic with a theory of action. Additionally, even if the Stoic objection did not target his own skeptical view, the fact that rational and virtuous action is possible despite his argument for universal suspension of assent would suffice to counter it. This is supported by scholars such as Stopper (1983), although other scholars such as Ioppolo (1986), Maconi (1988), and Thorsrud (2009) have different interpretations of the polemic.",stoicism
arcesilaus,Who was the founder of the Stoic school of philosophy?,Zeno of Citium was the founder of the Stoic school of philosophy.,stoicism
ethics-ancient,What is the Stoic view on the relationship between intellectual and moral virtues?,"The Stoics do not follow the Aristotelian distinction between intellectual and moral virtues. Instead, they hold that all human psychological functions, including the affective and volitional, are rational in a single, unified sense. For them, consequently, all virtues form a unity around the core concept of knowledge.",stoicism
ethics-ancient,What is the Stoic view on the relationship between preferred indifferents and virtue?,"According to Stoicism, preferred indifferents such as health, pleasure, and wealth do not contribute to one's virtue nor detract from it. They do not make one's life better or worse in a moral sense. However, preferred indifferents are still valued since they align with nature's plans for animals and plants, and one should try to preserve and maintain them when possible. Stoics distinguish between preferred indifferents, which are more desirable due to their alignment with nature's plans, and dispreferred indifferents, which hinder the natural order. Nonetheless, they maintain that only virtue and virtuous actions can be considered genuinely good.",stoicism
ethics-ancient,What is the role of reason in human actions according to Stoicism?,"According to Stoicism, reason plays a crucial role in human actions as it is the craftsman of impulse in adult humans. It shapes impulses and guides their expression in action, making it impossible for an adult human, whose nature is to do everything through reason, to merely follow natural impulses without reason's guidance.",stoicism
ethics-ancient,What are eupatheiai in Stoicism?,"Eupatheiai are feelings attuned to reason in Stoicism, such as joy over one's virtue. They are distinguished from emotions or passions ( pathê), which are incorrect impulses that treat what is indifferent as good, arising from false judgments about the good.",stoicism
ethics-ancient,What is the Stoic view on the relationship between virtues?,"According to Stoicism, virtues such as courage, justice, and moderation are all unified and derive from a single, comprehensive knowledge of what is good and bad in different kinds of circumstances.",stoicism
ethics-ancient,Why is understanding both one's individual nature as a human being and the way nature arranges the whole universe essential in Stoicism?,"Understanding both one's individual nature as a human being and the way nature arranges the whole universe is essential in Stoicism because this knowledge forms the basis for living in agreement with the government of the universe (nature), allowing one to make decisions and take actions that align with Zeus's or nature's plans, contributing to the overall good.",stoicism
ethics-ancient,What is the Stoic view on how one should respond to the loss of health if happiness is not to be vulnerable?,"According to Stoic philosophy, one should understand that the good of the whole may require the sacrifice of health, recognize that happiness does not depend on having health, and even agree with and desire this outcome as it aligns with the well-governed universe. This response is rooted in the Stoic view that virtue, as living in agreement with nature's government of the universe, is the only good and that one's happiness is entirely determined by his patterns of assent. Renunciation is not involved in this process if Stoic happiness has any relation to the ordinary sense. Instead, it is about acknowledging and adopting the perspective of the universe's well-governed nature.",stoicism
