category,question,answer,ideology
marcus-aurelius,What is the role of phantasia in Plato's Protagoras and how does it compare to an art of measurement?,"In Plato's Protagoras, phantasia, often translated as 'appearance', can be unreliable due to its comparative or perspectival nature (356b-357a). It is prone to errors and stands in need of correction by an unchanging standard, such as a meter ruler. This idea suggests that impressions, as mentioned in Marcus' work, may also suffer from similar defects of perspective and can benefit from testing against an informed understanding of physical, ethical, and dialectical principles, which provide a picture of the whole. Thus, phantasia in Plato's Protagoras is compared to an art of measurement as both can be used to evaluate and ensure the accuracy of perceptions and impressions.",stoicism
marcus-aurelius,What advice does Michel de Montaigne give on understanding and analyzing complex phenomena?,"Michel de Montaigne advises to always look at the whole of a complex phenomenon, and then break it down into its constituent parts, such as its cause, matter, point, and the time in which it must come to a stop.",stoicism
marcus-aurelius,Who are some notable figures in ancient ethics?,"Ethics was a significant area of study in ancient philosophy, with notable figures including Epictetus and Seneca. Their works have had a lasting impact on moral and ethical thought.",stoicism
marcus-aurelius,Who would like to express their gratitude for their comments on the article?,"Tad Brennan, Stephen Menn, and John Cooper would like to express their gratitude for their comments on the article.",stoicism
seneca,What could have contributed to the recent revival of interest in Seneca's philosophy?,"Several factors may have contributed to the recent revival of interest in Seneca's philosophy, including a general reappraisal of Roman culture, progress in understanding Greek Hellenistic philosophy, developments in contemporary ethics (such as a renewed interest in the theory of emotions, roles and relationships, and the fellowship of all human beings), and the perception that Seneca speaks to some distinctively modern concerns.",stoicism
seneca,Why is it incorrect to view Seneca's philosophical writings as autobiographical?,"Seneca's philosophical writings are not autobiographical because he creates a literary persona for himself, discussing questions that occupy him in a way that invites readers to think about issues in their own life rather than in Seneca's life.",stoicism
seneca,When were most of Seneca's works written in relation to his life events?,"Most of Seneca's works were written after his return to Rome in 49 from his Corsican exile, with the exception of a few consolations that were written earlier in his life, such as the Consolation to Marcia, the Consolation to His Mother Helvia, and the Consolation to Polybius. The Moral Letters to Lucilius and the Natural Questions were written during the last years of his life (62-65).",stoicism
seneca,Why is the ethical dimension of Seneca's philosophy so prominent?,"The ethical dimension of Seneca's philosophy is prominent because of his conception of philosophy as a salutary practice, aimed at promoting human well-being and therapy (on philosophy as therapy, see Nussbaum 1994; Setaioli 2014).",stoicism
seneca,How does Seneca's philosophical writing style engage with its readers?,"Seneca's philosophical writing style engages with its readers by viewing them as participants in philosophical thought, meandering between general and specific considerations, arguments, side-issues, and consolation. He believes that in order to benefit from philosophy, one cannot passively adopt insights; instead, one must actively think through the issues and genuinely assent to them.",stoicism
seneca,How does Seneca use his exile as a metaphor in Ad Heluiam (To His Mother Helvia)?,"In Ad Heluiam (To His Mother Helvia), Seneca uses his exile as a metaphor to address any kind of alienation from one's immediate community and any enforced detachment from it. He raises issues that political exile raises, making his consolations relatively independent of his particular situation and the particular addressee.",stoicism
seneca,"What is the source of the three kinds of life that Seneca discusses—the life of theory, the life of politics (or practice), and the life of pleasure?","The three kinds of life that Seneca discusses can be traced back to Aristotle's distinction between the life of contemplation (theory) and the life of politics, as well as Plato's and Aristotle's engagement with prominent views on the good (such as pleasure, honor, and wisdom).",stoicism
seneca,"What two functions does philosophy have, according to Seneca in On the Private Life and On Peace of Mind?","According to Seneca in On the Private Life and On Peace of Mind, philosophy has two functions. Firstly, it provides us with insight upon which to base our actions. Secondly, it requires us to devote time specifically to reflecting on truths such as only virtue is good, in order to restore our peace of mind.",stoicism
seneca,What does Seneca suggest is the role of an individual according to cosmopolitanism?,"According to Seneca, cosmopolitanism requires that an individual be of use to other people. If they cannot benefit many, they should aim to benefit a few, and if that is not possible, they should benefit those nearest to them, and if necessary, even themselves.",stoicism
seneca,Why does Seneca believe that one's desires for fame and money continue to be a problem unless they are constantly kept down?,"Seneca suggests that one's desires for fame and money will continue to be a problem unless they are constantly kept down because they have a tendency to raise their heads if not actively suppressed, in a Platonic fashion. This implies that simply understanding or knowing something is not enough to guide one's actions, but rather one must also feel its truth and relevance to one's own life in order for it to be effective in controlling these desires.",stoicism
seneca,Who are some of the scholars who have contributed to the discussion on Seneca's role in the discovery of the will?,"Some scholars who have contributed to the discussion on Seneca's role in the discovery of the will include I. Hadot, Voelke, Dihle, Donini, Kahn, Irwin, Rist, and Inwood. Additionally, Frede has argued that Epictetus plays a major role in the development of the conception of a will.",stoicism
seneca,What is the ultimate argument of Seneca when it seems like he is blaming the world for the difficulty of improving oneself?,"Seneca ultimately argues that we are standing in our own way, and that we weigh ourselves down or become a problem to ourselves through our own actions and thought processes. He emphasizes reflective engagement with one's thoughts as a means of self-transformation.",stoicism
seneca,"How does the study of nature and theology help us in removing ourselves from localized concerns, according to Seneca in Natural Questions?","According to Seneca, studying nature and theology helps us overcome our mortality and offers us a detached perspective on our localized concerns. This perspective is achieved by removing ourselves from our narrow focus on our own situation and needs, allowing us to become more like God.",stoicism
seneca,What is Seneca's view on the possibility of moderating emotions according to the provided text?,"According to the text, Seneca argues that emotions cannot be moderated; they must be replaced with rational responses, as he believes emotions are irrational and cannot be tamed because of their irrational nature. He supports this view by arguing that the ideal agent will avenge and defend others out of duty, not out of anger or lust for revenge.",stoicism
seneca,What is the origin of the virtue of clementia in Seneca's On Mercy?,"The virtue of clementia in Seneca's On Mercy has its origin in Roman self-descriptions and was originally displayed towards enemies, not towards one's own citizens. With Caesar, it becomes the virtue of an emperor.",stoicism
seneca,What does Seneca claim about how the virtuous person's life benefits others even if she does not perform any public function?,"Seneca claims that the virtuous person's life benefits others through her gait, silent persistence, and the expression of her eyes, just as some medication works merely through its smell. He believes that virtue has its good effects even from a distance.",stoicism
seneca,"What is the name of the longest extant Senecan treatise discussing one specific ethical topic, which is situated in the Roman social context but provides detailed analysis and rich examples of good deeds, badly performed favors, graceful receiving, and other related phenomena?","The name of the treatise is On Benefits (or: On Favors, lat. De beneficiis).",stoicism
seneca,How does Seneca define beneficia in a broad sense?,"Seneca defines beneficia as any kind of help a person might offer to another person as a member of a group, such that this strengthens the cohesion of the group and affirms or creates social bonds. This help can take many forms, including giving money or other material assistance, using one's influence in someone's favor, advancing someone's health or personal safety, teaching or educating someone, among others.",stoicism
seneca,What activities can slaves engage in that are considered benefits rather than obligations according to Seneca's perspective?,"Slaves can benefit their masters by doing more than they are compelled to do, reflecting an admirable ability to overcome resentment for their position, according to Seneca's perspective in Book 3.",stoicism
seneca,What does Seneca argue is lost if attitudes appropriate to lending and contractual obligations invade the domain of 'good deeds'?,"Seneca argues that something of great value would be lost if attitudes appropriate to lending and contractual obligations invade the domain of 'good deeds', as it would indicate that justice appears inferior in this sphere where faith in souls is replaced by faith in seals.",stoicism
seneca,What is the basis of Seneca's normative recommendations in On Benefits?,"Seneca's normative recommendations in On Benefits are based on his observations of what he perceives to be facts about human psychology. He believes that people tend to remember negative actions more than positive ones and that they have ever new desires, which can cause them to forget about past benefactions.",stoicism
seneca,"What is the proposed order of reading Seneca's Natural Questions, as supported by recent publications?","The proposed order of reading Seneca's Natural Questions is 3, 4a, 4b, 5, 6, 7, 1 and 2. This order is based on two recent publications that argue for this sequence as the most likely intended one.",stoicism
seneca,What is one way scholars have described the presence of discussions about human behavior in Seneca's Natural Questions?,"Scholars have described the presence of discussions about human behavior in Seneca's Natural Questions as going beyond the meteorological tradition, characterizing the treatise as an artistic engagement with nature where Seneca aims to make some of his points by contrasting the beauty of nature's workings with the ugliness of vicious action.",stoicism
seneca,Why does Seneca believe that natural philosophy is more practically valuable than the study of history?,"Seneca believes that natural philosophy is more practically valuable than the study of history because it focuses on teaching people what they should do (quid faciendum sit), as opposed to the study of history which focuses on what has already happened (quid factum). This is because natural philosophy deals with understanding the workings of the universe, of which we are a part, and allows us to gain a 'view from above' that liberates us from unreasonable concern with everyday issues.",stoicism
seneca,What is the role of natural laws in Seneca's philosophy?,"In Seneca's philosophy, natural laws govern events both above and under the earth, playing a crucial role in the functioning of the world. They constitute everything that is going to happen in the world, including earthquakes and even the conflagration of the world when it comes to an end. The natural law also dictates that human beings are mortal and death is a necessity. The study of nature involves accepting this natural law and understanding why death is not fearful. Preparation for death is an essential aspect of the philosophical life, as it helps individuals accept their mortality, which is a fundamental part of natural law.",stoicism
seneca,How does Seneca view the relationship between human life and time in both his natural philosophy and therapeutic practice?,"Seneca views human life as having a finite existence, with its end contained from the beginning, much like the world's life cycle in his natural philosophy. He emphasizes the importance of making diligent use of the present as a means to regain lost time consumed by worldly concerns. In his therapeutic practice, Seneca encourages being aware of the completeness of each day and living it well, as if it contains everything necessary, with no need to stretch out into an uncertain future. Death is seen as an inevitable part of life, and being prepared for it is a key aspect of living well.",stoicism
seneca,What does Seneca consider to be another name for God?,Nature is considered by Seneca to be another name for God.,stoicism
seneca,Why does Seneca believe that the common practice of praying indicates the existence of a caring God?,"Seneca believes that prayer indicates the existence of a caring God because he thinks that people would not engage in such behavior if they did not believe that there was someone listening and caring about their prayers. If people were addressing deaf deities, praying would be an irrational act in Seneca's view.",stoicism
seneca,What does Seneca believe is the role of prayer in relation to fate?,"According to Seneca, prayer cannot change fate as it is the necessity of all events and actions. However, prayer can be effective in dealing with some things since the gods have left some matters unresolved.",stoicism
seneca,What is Seneca's view on virtue and how it relates to perfecting rationality and becoming like God?,"Seneca views virtue as the ideal of becoming like God, which is not an otherworldly ideal but rather the perfecting of our rationality as agents living in this world. He thinks that the virtuous man is an equal to the gods, demonstrating the close relationship between his natural philosophy, theology, ethics, and philosophical psychology. Ultimately, Seneca is concerned with perfecting our soul, which he explores through discussions of virtue, the soul, nature, and theology.",stoicism
seneca,What philosophical tradition emphasizes that moral norms can be derived from nature and human reason?,The ethical tradition of natural law emphasizes that moral norms can be derived from nature and human reason.,stoicism
buddhism-chan,"What is the description of Zen Buddhism's special transmission that is not based on written words but directly points to the human heartmind, allowing one to see nature and become a Buddha?","The description of Zen Buddhism's special transmission is as a transmission outside the scriptures, not established upon words and letters, directly pointing to the human heartmind, and seeing nature and becoming a Buddha.",zen-buddhism
japanese-zen,What is the Zen perspective on the relationship between a thing-event's specificity and the whole?,"Zen understands the specificity of a thing-event to be a recapitulation of the whole, emphasizing that parts and the whole should be lived in an inseparable relationship through an exercise of nondiscriminatory wisdom, without prioritizing one aspect over another.",zen-buddhism
japanese-zen,"How does Zen's stance of ""not one"" and ""not two"" relate to both dualism and non-dualism?","Zen's stance of ""not one"" and ""not two"" negates both dualism and non-dualism, while allowing for a free, bilateral movement between the two. This position cannot be confined to either dualism or non-dualism, creating a unique third perspective.",zen-buddhism
japanese-zen,What is the significance of meditation in Zen Buddhism and how is it related to the achievement of enlightenment?,"Meditation is highly significant in Zen Buddhism as it is through meditation that the historical Buddha achieved enlightenment (nirvāna). Meditation is one of the three components of study that a Buddhist is required to master in Zen Buddhism, along with an observation of ethical precepts (sīla) and an embodiment of nondiscriminatory wisdom (prajñā). Meditation is believed to lead to a deepened state of consciousness called samādhi, which is a state of complete concentration and awareness. Zen Buddhists believe that practical, experiential knowledge is more important than theoretical, intellectual knowledge in achieving enlightenment, as the latter is seen as a form of discrimination through language. Instead, Zen Buddhists emphasize the importance of self-cultivation (shugyō) through the training of the whole person in order to prepare for embodying nondiscriminatory wisdom.",zen-buddhism
japanese-zen,What is the main purpose of using kōans in the Rinzai school of Zen Buddhism?,"The main purpose of using kōans in the Rinzai school of Zen Buddhism is to assist the practitioner in becoming a ""Zen person"" who fully embodies both wisdom and compassion. Kōans are formulated like riddles or puzzles that cannot be solved through intellectual reasoning alone, driving the ego-consciousness to its limit and breaking through the barrier of dualistic conceptual paradigms, allowing for a breakthrough in understanding.",zen-buddhism
japanese-zen,"What is the significance of passing kōans in the Rinzai school of Zen, and what is required for transmission to occur?","Passing kōans is a crucial part of the training in the Rinzai school of Zen, as it demonstrates the practitioner's understanding and attainment of enlightenment. The process involves private consultations with a Zen master who evaluates the practitioner's state of mind. The transmission of enlightenment is said to be possible only between Buddhas (yuibutsu yobutsu), emphasizing the profound and transformative nature of this spiritual exchange.",zen-buddhism
japanese-zen,What is the purpose of the fifth group of kōans in the most fully developed system?,The fifth group of kōans is designed for the practitioner to go beyond the state of buddhahood by erasing all traces of enlightenment in order to achieve a traceless enlightenment.,zen-buddhism
japanese-zen,"What does the final phrase of Rinzai school's self-cultivation process, ""seeing into [one’s] nature to become a buddha,"" refer to?","The final phrase of Rinzai school's self-cultivation process, ""seeing into [one’s] nature to become a buddha,"" refers to the concretization of the original or innate enlightenment that human beings possess, which enables them to become a Buddha.",zen-buddhism
japanese-zen,"What is the concept of ""practice-realization"" in the Sōtō school of Zen Buddhism according to Dōgen?","The concept of ""practice-realization"" in the Sōtō school of Zen Buddhism, as articulated by Dōgen, refers to meditation being both a practice and the realization of enlightenment simultaneously. It emphasizes that meditation is not a means to an end, but an end in itself, collapsing the dualistic gap between potentiality and actuality, and between acquired enlightenment and original enlightenment, which are considered non-dual in relation to each other.",zen-buddhism
japanese-zen,How does the Sōtō school view the process of meditational practice in terms of enlightenment?,"The Sōtō school sees meditational practice as a gradual deepening process of becoming aware of the original enlightenment, with an expansion of its corresponding experiential correlates and horizons. This is why it is called the school of ""gradual enlightenment"" or ""silent illumination.""",zen-buddhism
japanese-zen,What is the recommended order of adjustments Zen meditation practitioners should follow at the beginning of a sitting session?,"The recommended order of adjustments Zen meditation practitioners should follow at the beginning of a sitting session is body, breathing, and mind.",zen-buddhism
japanese-zen,Why is the adjustment of the body important in Zen meditation and what postures does Zen recognize?,"The adjustment of the body is important in Zen meditation because it helps the practitioner achieve an optimal state of being free by stilling the mind and dissolving various psychological complexes and psychosomatic disorders. Zen recognizes two postures for meditation: the lotus-posture and the half-lotus posture. A long Zen tradition holds that these postures are effective in achieving the benefits of meditation. However, if a lay practitioner cannot assume these postures initially, they can be substituted with sitting on a chair with the spine straight.",zen-buddhism
japanese-zen,What is the name of the breathing exercise in Zen meditation?,"The name of the breathing exercise in Zen meditation is ""observation of breath count"" or sūsokukan.",zen-buddhism
japanese-zen,"What does Zen refer to as ""wandering thoughts"" and how does it affect meditation practice?","In Zen, ""wandering thoughts"" refer to any mental object that prevents the practitioner from concentrating during meditation. Overcoming this is one of the first things a practitioner must learn to do in order to make progress in meditation. These thoughts can include present concerns, worries, fears, and past memories, all of which can distract the practitioner from staying focused on the present moment during meditation.",zen-buddhism
japanese-zen,What is the neurophysiological location where breathing is controlled and what system controls it under normal circumstances?,"The neurophysiological location where breathing is controlled is found in the hypothalamus, in the mid-brain, and it is controlled by the autonomic nervous system under normal circumstances.",zen-buddhism
japanese-zen,How does Zen propose that one can stop the operation of the conscious mind in order to enter a state of meditation?,"Zen proposes accomplishing this by assuming an immobile bodily posture and engaging in breathing exercises, rather than attempting to stop the mind by using the mind directly, which is considered impractical if not impossible.",zen-buddhism
japanese-zen,"What is the third stage of meditation in this practice, where there is no more feeling of in-coming and out-going breaths?","In the third stage of meditation, the practitioner enters a deeper state where there is no more feeling of in-coming and out-going breaths. During this stage, there is an prolonged retention of breath due to the reduction of breathing activities.",zen-buddhism
japanese-zen,What is the psychological mechanism that allows various thoughts and feelings to surface during meditation?,"The psychological mechanism that allows various thoughts and feelings to surface during meditation is the weakening of the suppressive power of ego-consciousness, which occurs when the level of consciousness is lowered.",zen-buddhism
japanese-zen,What is the ultimate goal of meditation according to the described process?,The ultimate goal of meditation according to the described process is to reach a state of non-dualistic thinking where there is no separation between the object of the mind and the activity of the mind itself.,zen-buddhism
japanese-zen,"What is the state of ""no-mind"" in Zen, and what is its relationship with ego-consciousness?","The state of ""no-mind"" in Zen is not a mindless state or the absence of mind, but rather, it is a state of mind that is free from the conscious activity associated with ego-consciousness in everyday life. No-mind is a transcendent state that goes beyond the everyday mind while still remaining in the everydayness of the world.",zen-buddhism
japanese-zen,What has been the goal of the intellectual effort of European philosophers since the modern period in their attempt to understand human nature?,"The goal of European philosophers since the modern period has been to find new ways to ground our conception of human nature beyond traditional Christian dogmas that had incorporated classic Aristotelian and Platonic views. They have attempted to capture human nature using various concepts such as ego-consciousness, Reason, Personality, Transcendental Subjectivity, Life, Existence, and Dasein as both starting points and destinations in their philosophical inquiries.",zen-buddhism
japanese-zen,How does Zen view the role of discursive reason in understanding reality?,"Zen maintains that discursive reason is incapable of knowing and understanding reality in its entirety, and instead advocates for seeking understanding through an experiential dimension that goes beyond ego-consciousness and the limitations of Aristotelian logic.",zen-buddhism
japanese-zen,"What does Abe mean when he says that Zen maintains a ""positionless position""?","When Abe says that Zen maintains a ""positionless position,"" he means that Zen avoids becoming attached to any particular position or viewpoint. This is because Zen believes that attachment leads to suffering, and it instead cherishes a sense of embodied freedom.",zen-buddhism
