category,question,answer,ideology
seneca,How does Seneca view his relationship with Stoicism and other philosophical schools?,"Seneca sees himself as an independent thinker who writes within the Stoic system but is not concerned with keeping Stoicism 'pure' from non-Stoic ideas. He feels free to disagree with earlier Stoics and integrates ideas from other philosophies if they seem helpful to him. He likens philosophical views to motions made in a meeting and is open to splitting them up to agree with one part and disagree with another. Seneca also adopts metaphors or images from other philosophical schools, such as Platonically inspired images of the body as prison of the soul, but this does not necessarily commit him to holding the theories in which they originate.",stoicism
seneca,What is the relationship between philosophy and politics in Seneca's Stoic cosmopolitanism?,"In Seneca's Stoic cosmopolitanism, philosophy and politics represent two worlds that we simultaneously belong to. The world of politics is our local world where we aim to do good to people in our vicinity through an active career in politics. On the other hand, retreating into philosophy allows us to live predominantly in the world at large and help others who are not necessarily spatially close to us through studying, teaching, and writing philosophy (Wildberger 2018a).",stoicism
seneca,Why does Seneca argue that the soul must be a body?,"Seneca argues that the soul must be a body because only bodies can act on anything and cause effects. This is in line with the Stoic view that the soul is corporeal, and it is emphasized in Letter 106.",stoicism
seneca,What is psychological monism in the context of Stoic philosophy?,"Psychological monism in Stoic philosophy is the view that there is no non-rational part or power of the soul. Instead, the soul is one insofar as its commanding faculty is one, and rational. This means that motivational conflict and irrational action do not result from a 'struggle' between the rational and the non-rational aspects of the soul. Instead, what we call irrational must be understood as (bad) states of the rational soul. Psychological monism is a counterposition to Plato’s and Aristotle’s account of the soul, and has major implications for the theory of action, ethics, and the theory of emotion.",stoicism
seneca,Why does Seneca argue that it is not enough to simply study arguments and objections related to the Stoic thesis that virtue alone brings happiness?,"Seneca argues that it is not enough to simply study arguments and objections related to the Stoic thesis that virtue alone brings happiness because one needs to think through the implications of this thesis in a variety of practical contexts, so as then to be able to live by it. He believes that thinking about these issues in the right way must become a way of life.",stoicism
seneca,What is the role of assent in Stoic understanding of human action and virtue?,"In Stoicism, assent is central to human action and virtue. Assenting to practical impressions generates impulse (hormê), which in turn leads to action if there is no external impediment. Since assent is under our control, it is in our power to become virtuous by deciding how we act, as we can choose to assent only to cognitive impressions that represent things precisely as they are.",stoicism
seneca,What is the key piece of Stoic doctrine regarding the relationship between assent and voluntary actions?,"According to Stoic doctrine, whether an individual is foolish or wise, it is within their power to assent or not assent to impressions, which in turn determines whether their actions are voluntary or not.",stoicism
seneca,"What does Veyne suggest about the possibility of using Stoicism, and specifically Seneca's works, for our own purposes even if it may not accurately reflect Stoicism's original meaning?","Veyne suggests that it is acceptable to ""abuse"" Seneca's works and use Stoicism as a philosophy of the active turning in on itself of the self, even if it did not originally have that meaning in its own historical context. He argues that this interpretation can be supported by reading Seneca's Letters in particular.",stoicism
seneca,What is the Stoic concept that involves fully appreciating the way in which everything outside of one's mind belongs to one?,The Stoic concept that involves fully appreciating the way in which everything outside of one's mind belongs to one is called 'oikeiôsis'.,stoicism
seneca,How have scholars interpreted Seneca's treatise On Anger in relation to Stoic psychological monism?,"Scholars have interpreted Seneca's treatise On Anger in two main ways in relation to Stoic psychological monism. Some scholars, such as Sorabji, have argued that Seneca's account of the emotions in On Anger is situated vis-à-vis early and middle Stoic theories that differ from his own. On the other hand, other scholars, such as Cooper and Vogt, have interpreted On Anger as basically in agreement with Stoic psychological monism, appreciating it for its detailed treatment of violent emotions as acts of the rational soul. These different interpretations reflect ongoing debates in Seneca scholarship regarding the consistency and development of Stoic theories of emotion.",stoicism
seneca,What is the Stoic view on the ideal agent's emotional state?,"The Stoic view on the ideal agent's emotional state is one of rational affective reactions and dispositions, rather than emotions. The ideal agent has ""good feelings"" of wishing, caution, and joy, as well as initial affective and physiological reactions that do not depend on assent, often referred to as proto-emotions.",stoicism
seneca,"What type of emotion is anger according to the Stoics, and what judgments are involved in feeling anger?","According to the Stoics, anger is a kind of desire that results in action. It is tied up with irrational action and involves several judgments, starting with 'He wronged me'. This initial judgment then leads to the desire for revenge, which is an impulse towards action if there is no external impediment",stoicism
seneca,"Why does the Stoic sage not experience a negative emotional response, such as deploring or feeling bad about, vice despite recognizing it as bad?","The reason Stoic sage does not experience a negative emotional response to vice is that virtue does not allow for rational negative affective responses, as they would not benefit the individual. Instead, the sage maintains cheerfulness as a form of benefit, giving hope rather than succumbing to distress.",stoicism
seneca,How does Seneca view preferred indifferents in Stoic ethics according to the text?,"According to the text, Seneca views preferred indifferents in Stoic ethics as having value but not being good in the terminological sense. He acknowledges that they can be challenging not to see as contributing to one's happiness but encourages his audience to become less attached to them while still taking care of them.",stoicism
seneca,What is Stoic philosopher Seneca's metaphorical comparison for placing value on indifferents?,"Stoic philosopher Seneca compares placing value on indifferents to preferring one good man over another based solely on his fancy haircut, implying that indifferents hold little significance when compared to genuine virtue. This comparison is used to emphasize that indifferents should not be given real importance in deliberation.",stoicism
seneca,Why did the Stoics write treatises about indifferents if they are not relevant to appropriate action?,"The Stoics wrote treatises about indifferents because they are not completely irrelevant to appropriate action. Indifferents are in fact the material of deliberation in specific situations and courses of action available in them involve indifferents, such as putting on appropriate clothes for a given occasion.",stoicism
seneca,Why have Letters 94 and 95 of Kidd (1978) been particularly relevant in discussions about rules in Stoic ethics?,"Letters 94 and 95 of Kidd (1978) have been relevant in discussions about rules in Stoic ethics because they provide evidence that can be interpreted as Stoics formulating rule-like precepts, which in turn has implications for understanding the Stoic conception of law as potentially consisting of a set of laws.",stoicism
seneca,"What is the role of decreta in Stoic philosophy, according to the provided text?","Decreta in Stoic philosophy refers to the most abstract and fundamental teachings of the Stoics, not practical principles or rules. They are the core tenets of Stoic philosophy that one needs to immerse oneself in to achieve virtue.",stoicism
seneca,What is the role of an advisor in Stoic philosophy according to Seneca's perspective?,"According to Seneca's perspective, an advisor in Stoic philosophy plays a crucial role in reminding individuals of insights such as 'money does not bring happiness' and providing specific advice tailored to particular occasions. The advisor's guidance is not based on strict rules, as situations are constantly changing and require balancing various considerations.",stoicism
seneca,What is the aspect of giving and receiving correctly that Seneca emphasizes in his treatise?,Seneca emphasizes that the relevant actions of giving and receiving correctly are the intention to benefit on the part of the giver and the intention to gratefully repay the favor on the part of the receiver. He argues that it is the act of willing which counts as a correct action in Stoic ethics.,stoicism
seneca,How does Seneca's discussion of benefits in Book 4 of his treatise relate to Stoic ethics and its conception of the good?,"Seneca's discussion of benefits in Book 4 does not rely on quintessentially Stoic assumptions or address the subtleties of Stoic conceptions of the good. Instead, it focuses on concrete problems arising from the exchange of favors in society, such as dependency and feelings of enslavement. The arguments about good deeds in Book 4 are essentially already laid out in Books 1 to 3, establishing that what matters are intentions and attitudes, independent of Stoic premises about the good. The Stoic view that the good and the advantageous are one and the same does not seem to align with Seneca's question about whether benefits ought to be given for their own sake or for the sake of some advantage to the giver in Book 4.",stoicism
seneca,What is the distinction Seneca makes between two types of notions of the good in Stoic ethics?,"Seneca distinguishes between two notions of the good in Stoic ethics. The first is a preconception of the good that human beings have from early on, before understanding any of the truths of Stoic philosophy. The second is a more advanced notion of the good that progressors, those who are making progress in Stoic wisdom, may come to see the point of without yet being fully able to consistently appreciate its truth in their lives. This second notion is the scientific concept of the good, which is only acquired once a human being turns into a wise person and recognizes that only virtue is good.",stoicism
seneca,How does Seneca help his readers understand what Stoics mean by virtue being good without having encountered a real-life instance of virtue?,Seneca uses cognitive operations such as magnifying the virtuous features of agents and minimizing their negative features in accounts of great deeds to help his readers understand what Stoics mean by virtue being good without having encountered a real-life instance of virtue.,stoicism
seneca,Why does Seneca invest time in discussing natural phenomena in the Natural Questions?,"Seneca discusses natural phenomena in the Natural Questions as part of a well-established genre aimed at providing rational explanations of natural phenomena to change the way people live in the world and fight superstition and fear. In particular, Seneca's Stoic perspective requires him to use detailed physical analysis to fight fear since the Stoic God is in principle capable of sending signs as opposed to the Epicurean perspective that God does not concern himself with human affairs.",stoicism
sextus-empiricus,What is the implication when it is mentioned that Sextus is using Stoic terminology and casting the issue in Stoic terms?,"This implies that Sextus is following the Stoic philosophical framework and using their concepts and language, which in this case is related to assenting to an impression that something is true (P).",stoicism
sextus-empiricus,Is the idea that Stoic scholarship accepts the issue discussed in Sandbach 1975: 88 as uncontroversial a matter of debate among scholars?,"No, the idea that Stoic scholarship accepts the issue discussed in Sandbach 1975: 88 as uncontroversial is not a matter of debate among scholars; it is widely accepted.",stoicism
sextus-empiricus,Who were some philosophers who held that there is one standard for judgment?,The Stoics were among those philosophers who held that there is one standard for judgment.,stoicism
sextus-empiricus,How did the Stoics categorize philosophy?,"The Stoics divided philosophy into Logic, Physics, and Ethics, following the traditional Stoic division of the field (Ierodiakonou 1993).",stoicism
sextus-empiricus,What is the significance of the 'criterion of truth' in the Pyrrhonian skeptic's philosophy and in contemporary scholarly debate?,"The 'criterion of truth' is highly significant in Pyrrhonian skepticism as it forms the crux of debates concerning whether a Pyrrhonian skeptic can hold beliefs. The notion of a criterion of truth was pivotal in both Stoic and Epicurean epistemologies, adding weight to its relevance in philosophical discussions.",stoicism
sextus-empiricus,What were the Epicureans and Stoics in agreement about with regards to truth?,"The Epicureans and Stoics agreed that there were criteria of truth, but they had different opinions about what those criteria were specifically.",stoicism
sextus-empiricus,"What are the two conceptions of the criterion of truth in ancient Greek philosophy, according to Brunschwig?","The two conceptions of the criterion of truth in ancient Greek philosophy, according to Brunschwig, are the 'adelic' conception which emphasizes the role of the criterion in the discovery of unclear things, and the 'prodelic' conception which emphasizes that those truths delivered by the criterion are clearly true. The Epicureans held the 'adelic' conception, while the Stoics held the 'prodelic' conception.",stoicism
shaftesbury,What is the debate concerning Shaftesbury's relationship to Stoicism?,The debate centers around whether Shaftesbury can be considered a Stoic thinker in its entirety or if some of his ideas align with Stoicism while others do not.,stoicism
shaftesbury,What does Shaftesbury's use of the Askemata notebooks suggest about his approach to Stoic principles?,"Shaftesbury's use of the Askemata notebooks suggests that he had Stoic ideas in the forefront of his mind and that he believed they were key to becoming the person he wanted to be. He engages in a process of self-improvement based on Stoic principles and quotes Stoic sources throughout these notebooks. Additionally, Shaftesbury's unpublished works such as Pathologia and Chartae Socraticae show his endorsement of Stoicism and rejection of contemporary philosophy.",stoicism
shaftesbury,What is the main idea of the strong Stoic interpretation of Shaftesbury's philosophy and what illustration does he use to convey this idea in Characteristicks?,"The main idea of the strong Stoic interpretation of Shaftesbury's philosophy is an exclusive concern with the state of one's own soul, which is within one's own control, and a resultant withdrawing of concern from everything else. This is conveyed in Characteristicks through the illustration of a ship on a bay and a ray of light on a still dish of water, which represents the calm serenity that comes from focusing on one's internal state and not allowing anything external to disturb it. This illustration echoes quotations from Marcus and Epictetus on the power of one's view and the state of one's soul.",stoicism
shaftesbury,What is one aspect of Shaftesbury's thought that commentators have noted as not fitting with the Stoic view?,One aspect of Shaftesbury's thought that commentators have noted as not fitting with the Stoic view is his concern with the public good and his endorsement of pity.,stoicism
shaftesbury,"Why might Shaftesbury discuss aesthetic beauty in his works, according to those who support the strong Stoic interpretation?","According to those who support the strong Stoic interpretation, Shaftesbury discusses aesthetic beauty as a means of attracting a wider audience towards a moral position that would otherwise be unappealing if presented in its raw form. In essence, aesthetic beauty serves as a decoy or sugar-coating, making his Stoic message more palatable while concealing his true belief that aesthetic beauty holds no value.",stoicism
shaftesbury,What does Shaftesbury consider as the metaphysical component of beauty?,"Shaftesbury considers ""Unity of Design"" as the metaphysical component of beauty. He believes that anything which has multiple parts that can be in unity with each other can be beautiful. This idea is deeply influenced by Aristotelian and Stoic conceptions of the fine and the beautiful.",stoicism
shaftesbury,How do some commentators view Shaftesbury's perspective on the relationship between art and virtue?,"Some commentators view Shaftesbury's perspective on the relationship between art and virtue as affirming the intrinsic value of virtue, while regarding art as having only an instrumental value in promoting virtue. They associate Shaftesbury with a backward-looking stance, reminiscent of Stoicism.",stoicism
shaftesbury,How does Shaftesbury reconcile his belief in the naturalness of morality and beauty with his contention that proper education is necessary to achieve them?,"Shaftesbury reconciles this apparent contradiction through the Stoic concept of prolepsis. Prolepses are mental anticipations or pre-conceptions of notions that do not depend on instruction or experience. However, prolepses are not fully formed concepts and can be poorly developed and misapplied. Therefore, practice and cultivation are necessary to give prolepses their most complete form and apply them properly. This allows Shaftesbury to argue that ethics requires the right application of affections and that mistaken ethical judgments result from a defect in the application of the natural rule of honesty and worth.",stoicism
skepticism-medieval,What standard do Stoics propose must be met in order for something to be considered as known?,"According to Stoics, in order for something to be considered as known, its truth must be such that it could not possibly be mentally caused by anything other than what it actually is in fact caused by. For instance, if an internal mental image or concept of a tree's being beside a house could be caused by a dream, then the tree's being beside the house cannot be known, even if the tree is in fact beside the house.",stoicism
smith-moral-political,"How does Smith conclude The Theory of Moral Sentiments, and what does this suggest about his perspective on moral philosophy?","Smith concludes The Theory of Moral Sentiments by presenting the virtues of prudence, benevolence, and self-command through character portraits in Part VI, and offering a short history of moral philosophy in Part VII that highlights the contributions of Plato, Aristotle, and the Stoics. This suggests that Smith might look forward to a revival of ancient Greek ethics and values, focusing on virtuous character rather than specific decision procedures. However, he does not endorse any ancient moral theorist uncritically.",stoicism
sophie-de-grouchy,"Who was the woman who edited her husband's works from 1795 until her death in 1822 and kept in regular touch with Cabanis, and what was her relationship to France's philosophical life during that time?",The woman who edited her husband's works from 1795 until her death in 1822 and kept in regular touch with Cabanis was a dedicated participant in France's philosophical life through her salon. She worked on physiology and later Stoicism with Cabanis.,stoicism
sophie-de-grouchy,How does the philosophy of Grouchy integrate different ethical theories?,"Grouchy's moral philosophy integrates elements from ancient virtue ethics, stoicism, and utilitarianism, creating a unique combination of ideas from distinct ethical theories.",stoicism
sophie-de-grouchy,How do Stoics argue that concern for others is natural to human beings?,"Stoics argue that concern for others is natural to human beings by invoking the concept of oikeiosis, which holds that infants have a natural concern for self-preservation that grows to extend to an impartial concern for all as they mature. They observe that infants learn to recognize their own bodies as belonging to them and use them for their own survival, and that this tendency develops further in human beings to include caring for their young and even cosmopolitanism.",stoicism
sophie-de-grouchy,"What philosophical view towards morality might Grouchy's emphasis on pain and pleasure imply, as suggested in some of her discussions of what it means to do the right thing?","Grouchy's strong emphasis on pain and pleasure might suggest that her moral theoretical leanings are towards consequentialism rather than Stoicism. Her discussions of what it means to do the right thing seem to be informed by consequentialism, as evidenced by her claim in Letter V that acts receive reason's approval depending on the extent to which they benefit humanity, and her suggestion in Letter VIII that the value of the law can be measured in part in terms of the pleasure and pain it produces.",stoicism
sophie-de-grouchy,What philosophical view did Cabanis appreciate in Stoicism that he tried to reconcile with his agreement with Grouchy about the role of pain in sympathy and morality?,Cabanis appreciated the possibility of atheism that still saw something divinely pleasing in all living things in Stoicism. He was attracted to this view because it allowed him to reconcile his agreement with Grouchy about the role of pain in sympathy and morality with his rejection of the Stoic view that pains and pleasure don't matter morally.,stoicism
sophie-de-grouchy,Why does Cabanis argue that the Stoics' view that pain is not bad is inconsistent with their humaneness?,"Cabanis argues that if pain was not an evil, we would not find it necessary to discount it in ourselves or others. Therefore, the fact that the Stoics exhibit humaneness and concern for others in the face of pain suggests that they do in fact view pain as an evil, contrary to their explicit philosophical position.",stoicism
sophie-de-grouchy,Can Stoics disregard pain when it comes to acting?,"No, Stoics do not countenance the view that pain should be ignored when it comes to acting. This is demonstrated by examples of Cato giving up his horse for his companion on a scorching road in Sicily and Brutus giving his coat to a sick slave on a freezing winter night.",stoicism
speusippus,"Who does Cicero attribute the view to that many things such as poverty and ill health are bad, but virtue alone is sufficient for happiness?","Cicero attributes this view to Aristotle, Speusippus, Xenocrates, and Polemon, but he himself rejects it and holds the Stoic view that virtue alone guarantees happiness.",stoicism
spinoza,"Who is considered one of the most important philosophers of the early modern period, known for his highly original system that combines elements from Descartes, Stoicism, Hobbes, and medieval Jewish rationalism?","Bento Spinoza is considered one of the most important philosophers of the early modern period, known for his highly original system that combines elements from Descartes, Stoicism, Hobbes, and medieval Jewish rationalism.",stoicism
spinoza,How would you describe the similarity between Spinoza's ethical theory and Stoicism?,"Spinoza's ethical theory has certain similarities with Stoicism, as it shares some doctrines with thinkers such as Cicero and Seneca.",stoicism
stoicism,What is the origin of the name of the Stoic philosophical movement?,The name of the Stoic philosophical movement derives from the porch (stoa poikilê) in the Agora at Athens where the members of the school congregated and held their lectures.,stoicism
stoicism,"Who are some of the major sources of our knowledge about Stoicism, including both those who discuss Stoicism in their own works and those who provide doxographical accounts?","Some of the major sources of our knowledge about Stoicism include pseudo-Plutarch's Philosophers' Opinions on Nature, Diogenes Laertius' Lives of Eminent Philosophers, Stobaeus' Excerpts, Cicero's Academic Books, On the Nature of the Gods, and On Ends, as well as the works of Alexander of Aphrodisias, Plutarch of Chaeronea, Galen, Sextus Empiricus, Plotinus, Eusebius, Nemesius, and Simplicius. Many of these sources are doxographical in nature, while others are hostile witnesses who discuss Stoicism in order to critique it. Cicero is an exception, as he provides sympathetic summaries of Stoicism in his works.",stoicism
stoicism,What is the Stoics' understanding of what exists according to the criterion of having the capacity to act or be acted upon?,"According to the Stoics, only bodies exist, as they are the only things that have the capacity to act or be acted upon. However, they also recognize that there are other ways of appearing in the complete inventory of the world than by virtue of existing, such as incorporeal things like time, place, or sayables which they consider 'subsistent'.",stoicism
